import { AuthorData } from '../types';

export const data: AuthorData = {
  author: {
  "id": "orangine",
  "name": "Orangine",
  "icon": "https://i.ibb.co/Z6cxDtcf/ezgif-com-cut.gif",
  "background": "https://i.ibb.co/9m2HktWF/cyberpunk-edgerunners-lucy.jpg",
  "color": "#d02be6",
  "summary": "Apaixonado por compartilhar fotografia virtual, capturando momentos de tirar o fôlego de mundos digitais.",
  "socials": [
    {
      "name": "Instagram",
      "url": "https://www.instagram.com/sweet.orangine/"
    },
    {
      "name": "Twitter",
      "url": "https://x.com/OranginePlace"
    }
  ],
  "allowDownloads": true,
  "bannerStyle": "standard",
  "featuredImageId": "PM-LFH8YU",
  "galleryStyle": "masonry"
},
  images: [
  {
    "id": "PM-8GR7T6",
    "title": "The First Descendant",
    "date": "12/02/2026",
    "tbn": "https://i.ibb.co/rKSmtVJG/PM-8-GR7-T6-thumb.jpg",
    "src": "https://i.ibb.co/LdK5M1TV/PM-8-GR7-T6-source.jpg",
    "width": 2160,
    "height": 3840,
    "dominantColor": "#191110",
    "palette": ["#b5756b", "#191110", "#663d34", "#d5dcd2", "#4e728f", "#729ba6", "#425466", "#303d55"],
    "words": [],
    "characters": ["Dia"],
    "extras": [],
    "delete_url": "https://ibb.co/7th4HK3s/5800764485d581a14f2da4fb40c4c6ef"
  },
  {
    "id": "PM-T3DW7J",
    "title": "The First Descendant",
    "date": "12/02/2026",
    "tbn": "https://i.ibb.co/99tJrtfj/PM-T3-DW7-J-thumb.jpg",
    "src": "https://i.ibb.co/LDQm242J/PM-T3-DW7-J-source.jpg",
    "width": 2160,
    "height": 2160,
    "dominantColor": "#140d0f",
    "palette": ["#b8736b", "#140d0e", "#1216ae", "#6c3730", "#151566", "#b17fd7", "#787c81", "#424442"],
    "words": [],
    "characters": ["Dia"],
    "extras": [],
    "delete_url": "https://ibb.co/ZRH5kykY/f02ec895aa959d350638caff645a957b"
  },
  {
    "id": "PM-HIIEZS",
    "title": "The First Descendant",
    "date": "10/02/2026",
    "tbn": "https://i.ibb.co/gFLbnMNH/PM-HIIEZS-thumb.jpg",
    "src": "https://i.ibb.co/7JHZtrM1/PM-HIIEZS-source.jpg",
    "width": 3761,
    "height": 1612,
    "dominantColor": "#68a5ad",
    "palette": ["#65a9b2", "#2d3a41", "#276977", "#afc9c4", "#3e6a74", "#94baba", "#325c5b", "#a3ccc2"],
    "words": [],
    "characters": ["Dia"],
    "extras": [],
    "delete_url": "https://ibb.co/d0SV4kC5/e9a6a8650b3d655a9347edf4f2de43f7"
  },
  {
    "id": "PM-56OP4S",
    "title": "Arknights: Endfield",
    "date": "25/01/2026",
    "tbn": "https://i.ibb.co/nNvKqD32/PM-56-OP4-S-thumb.jpg",
    "src": "https://i.ibb.co/dwqDtzgX/PM-56-OP4-S-source.jpg",
    "width": 2100,
    "height": 2100,
    "dominantColor": "#1e2940",
    "palette": ["#19243b", "#a7aeb3", "#9a847c", "#5f6f80", "#6487ae", "#36557a", "#62535b", "#16a8c1"],
    "words": [],
    "characters": ["Avywenna"],
    "extras": []
  },
  {
    "id": "PM-JTK3Q6",
    "title": "Arknights: Endfield",
    "date": "25/01/2026",
    "tbn": "https://i.ibb.co/B50HYdFN/PM-JTK3-Q6-thumb.jpg",
    "src": "https://i.ibb.co/nqCKxRDK/PM-JTK3-Q6-source.jpg",
    "width": 3840,
    "height": 2160,
    "dominantColor": "#2f3d55",
    "palette": ["#22324b", "#afc8d6", "#a69996", "#758698", "#7c9fbf", "#4e698d", "#766266", "#54b4c4"],
    "words": [],
    "characters": ["Avywenna"],
    "extras": []
  },
  {
    "id": "PM-XW6GT4",
    "title": "Where Winds Meet",
    "date": "14/01/2026",
    "tbn": "https://i.ibb.co/h6myPj3/PM-XW6-GT4-thumb.jpg",
    "src": "https://i.ibb.co/Wv7dHh8J/PM-XW6-GT4-source.jpg",
    "width": 3840,
    "height": 2160,
    "dominantColor": "#233125",
    "palette": ["#b9b381", "#18241b", "#6a7653", "#839960", "#3c523d", "#4e6748", "#6d7bb4", "#3b5364"],
    "words": ["wwm"],
    "characters": [],
    "extras": []
  },
  {
    "id": "PM-UPAS57",
    "title": "Where Winds Meet",
    "date": "09/01/2026",
    "tbn": "https://i.ibb.co/CKBsFKFH/PM-UPAS57-thumb.jpg",
    "src": "https://i.ibb.co/YFc1WmM1/PM-UPAS57-source.jpg",
    "width": 2160,
    "height": 3840,
    "dominantColor": "#27201d",
    "palette": ["#c29d9c", "#241e1b", "#a6726e", "#7e5c61", "#947998", "#6b3f3e", "#59446a", "#db983f"],
    "words": ["wwm"],
    "characters": [],
    "extras": [],
    "description": "I defied the martial world, yet I yielded to you."
  },
  {
    "id": "PM-RX4VVF",
    "title": "Where Winds Meet",
    "date": "09/01/2026",
    "tbn": "https://i.ibb.co/Qjmt9nnG/PM-RX4-VVF-thumb.jpg",
    "src": "https://i.ibb.co/KjRP29R2/PM-RX4-VVF-source.jpg",
    "width": 1728,
    "height": 2160,
    "dominantColor": "#b78e8a",
    "palette": ["#b8908c", "#271f1c", "#734847", "#807b9d", "#a4423d", "#ae464e", "#495766", "#579284"],
    "words": ["wwm"],
    "characters": [],
    "extras": []
  },
  {
    "id": "PM-I5KUEW",
    "title": "Where Winds Meet",
    "date": "09/01/2026",
    "tbn": "https://i.ibb.co/VW6Jk1vX/PM-I5-KUEW-thumb.jpg",
    "src": "https://i.ibb.co/1JYfXf98/PM-I5-KUEW-source.jpg",
    "width": 3840,
    "height": 2160,
    "dominantColor": "#2a1f1c",
    "palette": ["#b68f8a", "#261e1a", "#7e6063", "#6a3133", "#a41d2c", "#7f7497", "#473c5e", "#8292a2"],
    "words": ["wwm"],
    "characters": [],
    "extras": []
  },
  {
    "id": "PM-ATKP2A",
    "title": "Where Winds Meet",
    "date": "09/01/2026",
    "tbn": "https://i.ibb.co/zVb7NRJN/PM-ATKP2-A-thumb.jpg",
    "src": "https://i.ibb.co/xVpskgk/PM-ATKP2-A-source.jpg",
    "width": 2160,
    "height": 3840,
    "dominantColor": "#161515",
    "palette": ["#94786e", "#151414", "#58453f", "#332926", "#686667", "#3c3c3c", "#5d5c64", "#3b343c"],
    "words": ["wwm"],
    "characters": [],
    "extras": []
  },
  {
    "id": "PM-UJB1IV",
    "title": "Where Winds Meet",
    "date": "19/12/2025",
    "tbn": "https://i.ibb.co/nsXHZhGY/PM-UJB1-IV-thumb.jpg",
    "src": "https://i.ibb.co/GQN5gMhH/PM-UJB1-IV-source.png",
    "width": 2160,
    "height": 3840,
    "dominantColor": "#1b181d",
    "palette": ["#18161b", "#654840", "#95715f", "#3f3131", "#b19676", "#4b4a54", "#84848c", "#4c5454"],
    "words": ["wwm"],
    "characters": [],
    "extras": []
  },
  {
    "id": "PM-X2VBUD",
    "title": "Where Winds Meet",
    "date": "09/12/2025",
    "tbn": "https://i.ibb.co/Xf7ZBh18/PM-X2-VBUD-thumb.jpg",
    "src": "https://i.ibb.co/0yNYbN8V/PM-X2-VBUD-source.png",
    "width": 2160,
    "height": 3840,
    "dominantColor": "#272621",
    "palette": ["#b78e79", "#26241c", "#7b5844", "#536ca9", "#364566", "#8b9eb3", "#566a5c", "#9c3a44"],
    "words": ["wwm"],
    "characters": [],
    "extras": []
  },
  {
    "id": "PM-Z7Y9ZR",
    "title": "Where Winds Meet",
    "date": "08/12/2025",
    "tbn": "https://i.ibb.co/QvptYTXx/PM-Z7-Y9-ZR-thumb.jpg",
    "src": "https://i.ibb.co/1t85Hmr3/PM-Z7-Y9-ZR-source.png",
    "width": 2160,
    "height": 3840,
    "dominantColor": "#2b282d",
    "palette": ["#c4977b", "#2a262b", "#78514c", "#b6362a", "#4a4f5f", "#585e6b", "#908b8c", "#93948c"],
    "words": ["wwm"],
    "characters": [],
    "extras": []
  },
  {
    "id": "PM-DECJ3P",
    "title": "Where Winds Meet",
    "date": "02/12/2025",
    "tbn": "https://i.ibb.co/MkVjzvTc/Where-Winds-Meet-2025-12-02-00-07-21-00.png",
    "src": "https://i.ibb.co/YBkK5C9c/Where-Winds-Meet-2025-12-02-00-07-21-00.png",
    "width": 2160,
    "height": 3840,
    "dominantColor": "#6a7e98",
    "palette": ["#102030", "#80b0d0", "#5090c0", "#70a0d0", "#102040", "#60a0d0", "#6090c0", "#4080c0"],
    "words": ["wwm"],
    "characters": [],
    "extras": []
  },
  {
    "id": "PM-GQF9C4",
    "title": "Where Winds Meet",
    "date": "02/12/2025",
    "tbn": "https://i.ibb.co/h1J32n5C/Where-Winds-Meet-2025-12-02-00-08-40-00.png",
    "src": "https://i.ibb.co/h1J32n5C/Where-Winds-Meet-2025-12-02-00-08-40-00.png",
    "width": 2160,
    "height": 3840,
    "dominantColor": "#a7685e",
    "palette": ["#301020", "#401020", "#501020", "#f0a080", "#e08080", "#301010", "#d07080", "#f0b080"],
    "words": ["wwm"],
    "characters": [],
    "extras": []
  },
  {
    "id": "PM-BTCGUD",
    "title": "Where Winds Meet",
    "date": "02/12/2025",
    "tbn": "https://i.ibb.co/GbTRFB4/Where-Winds-Meet-2025-12-02-00-09-26-00.png",
    "src": "https://i.ibb.co/764Kb8d/Where-Winds-Meet-2025-12-02-00-09-26-00.png",
    "width": 3840,
    "height": 2160,
    "dominantColor": "#b8714e",
    "palette": ["#f08060", "#e07060", "#301020", "#f09060", "#f0a050", "#401020", "#f09050", "#502040"],
    "words": ["wwm"],
    "characters": [],
    "extras": []
  },
  {
    "id": "PM-PNZHMF",
    "title": "Where Winds Meet",
    "date": "02/12/2025",
    "tbn": "https://i.ibb.co/Gz4bCYN/Where-Winds-Meet-2025-12-02-00-013-19-00.png",
    "src": "https://i.ibb.co/gkLBtqh/Where-Winds-Meet-2025-12-02-00-013-19-00.png",
    "width": 3840,
    "height": 2160,
    "dominantColor": "#301b21",
    "palette": ["#301010", "#401010", "#501010", "#600010", "#800010", "#700010", "#900010", "#500010"],
    "words": ["wwm"],
    "characters": [],
    "extras": []
  },
  {
    "id": "PM-WCKPO3",
    "title": "Where Winds Meet",
    "date": "02/12/2025",
    "tbn": "https://i.ibb.co/LXZpgKGQ/Where-Winds-Meet-2025-12-02-00-15-49-00.png",
    "src": "https://i.ibb.co/9krY4PMw/Where-Winds-Meet-2025-12-02-00-15-49-00.png",
    "width": 2160,
    "height": 3840,
    "dominantColor": "#2d2a2a",
    "palette": ["#301010", "#402020", "#301020", "#502020", "#401020", "#401010", "#501020", "#601020"],
    "words": ["wwm"],
    "characters": [],
    "extras": []
  },
  {
    "id": "PM-0MOWYG",
    "title": "Where Winds Meet",
    "date": "26/11/2025",
    "tbn": "https://i.ibb.co/kYWLkrB/Where-Winds-Meet-2025-11-26-18-06-42-00.png",
    "src": "https://i.ibb.co/Sq9kW1y/Where-Winds-Meet-2025-11-26-18-06-42-00.png",
    "width": 2160,
    "height": 5120,
    "dominantColor": "#6d5586",
    "palette": ["#303060", "#202040", "#303070", "#404080", "#504090", "#6050a0", "#303050", "#404090"],
    "words": ["wwm"],
    "characters": [],
    "extras": []
  },
  {
    "id": "PM-83X8DP",
    "title": "Where Winds Meet",
    "date": "26/11/2025",
    "tbn": "https://i.ibb.co/FdjXbbj/Where-Winds-Meet-2025-11-26-18-07-42-00.png",
    "src": "https://i.ibb.co/CST655T/Where-Winds-Meet-2025-11-26-18-07-42-00.png",
    "width": 5120,
    "height": 2160,
    "dominantColor": "#7b8496",
    "palette": ["#203040", "#a0c0d0", "#a08070", "#90b0c0", "#ad88d3"],
    "words": ["wwm"],
    "characters": [],
    "extras": [],
    "description": "Vagando por Qinghe em meio ao vento e às flores.",
    "original": "https://i.ibb.co/N6BMjgNQ/PM-83-X8-DP-before.jpg"
  },
  {
    "id": "PM-0BEUM8",
    "title": "The First Descendant",
    "date": "23/11/2025",
    "tbn": "https://i.ibb.co/35JzhDb2/The-First-Descendant-2025-11-23-19-35-49-08.png",
    "src": "https://i.ibb.co/JWhQkfTV/The-First-Descendant-2025-11-23-19-35-49-08.png",
    "width": 2160,
    "height": 3840,
    "dominantColor": "#b8c664",
    "palette": ["#b8c664", "#805040", "#c09080", "#6080b0", "#402020", "#4070a0", "#704030", "#5080a0"],
    "words": ["tfd"],
    "characters": ["Harris"],
    "extras": []
  },
  {
    "id": "PM-RH0FUU",
    "title": "The First Descendant",
    "date": "20/11/2025",
    "tbn": "https://i.ibb.co/TxxSYsKD/The-First-Descendant-2025-11-20-13-48-55-27.png",
    "src": "https://i.ibb.co/Q33Rp487/The-First-Descendant-2025-11-20-13-48-55-27.png",
    "width": 1216,
    "height": 2160,
    "dominantColor": "#615e6c",
    "palette": ["#102030", "#102040", "#203040", "#202040", "#303050", "#304050", "#304060", "#506080"],
    "words": ["tfd"],
    "characters": ["Serena"],
    "extras": []
  },
  {
    "id": "PM-0KNNB5",
    "title": "The First Descendant",
    "date": "20/11/2025",
    "tbn": "https://i.ibb.co/gbBTSs0z/PM-Q0-YIMU-thumb.jpg",
    "src": "https://i.ibb.co/Gf7WkrBm/The-First-Descendant-2025-11-20-13-53-22-15.png",
    "width": 3840,
    "height": 2160,
    "dominantColor": "#7f8ca4",
    "palette": ["#a0b0d0", "#b0c0d0", "#a0c0d0", "#405080", "#405070", "#506080", "#c0d0e0", "#304060"],
    "words": ["tfd"],
    "characters": ["Serena"],
    "extras": []
  },
  {
    "id": "PM-BOOR3P",
    "title": "Where Winds Meet",
    "date": "17/11/2025",
    "tbn": "https://i.ibb.co/xKdh2fBQ/Where-Winds-Meet-2025-11-17-04-08-42-00.png",
    "src": "https://i.ibb.co/1YjZ0dPx/Where-Winds-Meet-2025-11-17-04-08-42-00.png",
    "width": 2088,
    "height": 2088,
    "dominantColor": "#484343",
    "palette": ["#403020", "#807060", "#504030", "#706050", "#503030", "#605040", "#604030", "#908070"],
    "words": ["tfd"],
    "characters": [],
    "extras": []
  },
  {
    "id": "PM-137XZK",
    "title": "The First Descendant",
    "date": "14/11/2025",
    "tbn": "https://i.ibb.co/tM2sGkX2/The-First-Descendant-2025-11-14-01-56-19-95.png",
    "src": "https://i.ibb.co/WWzyhqtz/The-First-Descendant-2025-11-14-01-56-19-95.png",
    "width": 2160,
    "height": 2160,
    "dominantColor": "#203022",
    "palette": ["#103020", "#103010", "#104020", "#505030", "#506040", "#50c050", "#708050", "#104010"],
    "words": ["tfd"],
    "characters": ["Ultimate Freyna"],
    "extras": []
  },
  {
    "id": "PM-Q0ZFWH",
    "title": "The First Descendant",
    "date": "13/11/2025",
    "tbn": "https://i.ibb.co/Y4PC1W0W/The-First-Descendant-2025-11-13-02-11-49-42.png",
    "src": "https://i.ibb.co/9mcD1vZv/The-First-Descendant-2025-11-13-02-11-49-42.png",
    "width": 1215,
    "height": 2160,
    "dominantColor": "#667e98",
    "palette": ["#4070a0", "#6090b0", "#70a0c0", "#406090", "#5080a0", "#407090", "#203050", "#5080b0"],
    "words": ["tfd"],
    "characters": ["Hailey"],
    "extras": []
  },
  {
    "id": "PM-BL3U32",
    "title": "The First Descendant",
    "date": "13/11/2025",
    "tbn": "https://i.ibb.co/XZCx6q3m/The-First-Descendant-2025-11-13-02-18-08-67.png",
    "src": "https://i.ibb.co/4ZVRCHYB/The-First-Descendant-2025-11-13-02-18-08-67.png",
    "width": 3840,
    "height": 2160,
    "dominantColor": "#939ba9",
    "palette": ["#a0b0c0", "#90a0b0", "#8090a0", "#607080", "#9090b0", "#8090b0", "#708090", "#a0a0c0"],
    "words": ["tfd"],
    "characters": ["Hailey"],
    "extras": []
  },
  {
    "id": "PM-CW4IFZ",
    "title": "The First Descendant",
    "date": "11/11/2025",
    "tbn": "https://i.ibb.co/w13H1Q8/The-First-Descendant-2025-11-11-01-56-08-68.png",
    "src": "https://i.ibb.co/LfbwfgB/The-First-Descendant-2025-11-11-01-56-08-68.png",
    "width": 2160,
    "height": 3840,
    "dominantColor": "#181d24",
    "palette": ["#102030", "#203050", "#102040", "#204060", "#103050", "#203040", "#204070", "#405070"],
    "words": ["tfd"],
    "characters": ["Valby"],
    "extras": []
  },
  {
    "id": "PM-SVJ0C9",
    "title": "The First Descendant",
    "date": "11/11/2025",
    "tbn": "https://i.ibb.co/DfZpy0n8/The-First-Descendant-2025-11-11-02-16-22-29.png",
    "src": "https://i.ibb.co/yFrS1HJY/The-First-Descendant-2025-11-11-02-16-22-29.png",
    "width": 3840,
    "height": 2160,
    "dominantColor": "#1b1b20",
    "palette": ["#405060", "#506070", "#604050", "#607080", "#708090", "#b090a0"],
    "words": ["tfd"],
    "characters": ["Valby"],
    "extras": []
  },
  {
    "id": "PM-A6PE0K",
    "title": "The First Descendant",
    "date": "02/09/2025",
    "tbn": "https://i.ibb.co/MD4CVVsq/PM-A6-PE0-K-thumb.jpg",
    "src": "https://i.ibb.co/hJZFgZLz/PM-A6-PE0-K-source.jpg",
    "width": 3840,
    "height": 2160,
    "dominantColor": "#3e352a",
    "palette": ["#3b3328", "#d6cfbd", "#ab946d", "#8d7b5c", "#786044", "#9b9b94", "#6a635c", "#9ca491"],
    "words": ["tfd"],
    "characters": ["Serena"],
    "extras": [],
    "delete_url": "https://ibb.co/zT7Vm7Qv/07683f7cf54fc85719566b4b2e727100",
    "thumb_delete_url": "https://ibb.co/Z6PM88Vy/1baba4a0814d7a179222769f3d9be9a5"
  },
  {
    "id": "PM-254MCE",
    "title": "The First Descendant",
    "date": "02/09/2025",
    "tbn": "https://i.ibb.co/Csph1pzW/The-First-Descendant-2025-09-02-23-43-30-95.png",
    "src": "https://i.ibb.co/HpLnFLVX/The-First-Descendant-2025-09-02-23-43-30-95.png",
    "width": 5120,
    "height": 2160,
    "dominantColor": "#797061",
    "palette": ["#403020", "#504030", "#605030", "#807050", "#706040", "#908060", "#605040", "#907050"],
    "words": ["tfd"],
    "characters": ["Serena"],
    "extras": []
  },
  {
    "id": "PM-SWDZWU",
    "title": "The First Descendant",
    "date": "02/09/2025",
    "tbn": "https://i.ibb.co/G305jGb9/The-First-Descendant-2025-09-02-23-46-06-15.png",
    "src": "https://i.ibb.co/5x6RVCfk/The-First-Descendant-2025-09-02-23-46-06-15.png",
    "width": 5120,
    "height": 2160,
    "dominantColor": "#6f6454",
    "palette": ["#403020", "#504030", "#706040", "#807050", "#605030", "#908060", "#605040", "#907050"],
    "words": ["tfd"],
    "characters": ["Serena"],
    "extras": []
  },
  {
    "id": "PM-QGZDVK",
    "title": "The First Descendant",
    "date": "02/09/2025",
    "tbn": "https://i.ibb.co/bj9CFgC4/The-First-Descendant-2025-09-02-23-49-14-04.png",
    "src": "https://i.ibb.co/j9XQzvQC/The-First-Descendant-2025-09-02-23-49-14-04.png",
    "width": 3840,
    "height": 2160,
    "dominantColor": "#726655",
    "palette": ["#403020", "#504030", "#706040", "#807050", "#605030", "#605040", "#908060", "#a09060"],
    "words": ["tfd"],
    "characters": ["Serena"],
    "extras": []
  },
  {
    "id": "PM-VH4296",
    "title": "The First Descendant",
    "date": "01/09/2025",
    "tbn": "https://i.ibb.co/LdVQsffT/The-First-Descendant-2025-09-01-02-31-01-25.png",
    "src": "https://i.ibb.co/k2N3PFFL/The-First-Descendant-2025-09-01-02-31-01-25.png",
    "width": 3840,
    "height": 2160,
    "dominantColor": "#837150",
    "palette": ["#403020", "#604020", "#503020", "#302010", "#b09050", "#a08040", "#907040", "#806030"],
    "words": ["tfd"],
    "characters": ["Ultimate Bunny"],
    "extras": []
  },
  {
    "id": "PM-L1KDZM",
    "title": "The First Descendant",
    "date": "01/09/2025",
    "tbn": "https://i.ibb.co/4nWH9Pjn/The-First-Descendant-2025-09-01-02-34-28-30.png",
    "src": "https://i.ibb.co/fzMsB4Cz/The-First-Descendant-2025-09-01-02-34-28-30.png",
    "width": 3840,
    "height": 2160,
    "dominantColor": "#87785c",
    "palette": ["#403020", "#503020", "#604020", "#c0a060", "#e0e0c0", "#b09050", "#c0b070", "#b0a060"],
    "words": ["tfd"],
    "characters": ["Ultimate Bunny"],
    "extras": []
  },
  {
    "id": "PM-GKNZKI",
    "title": "The First Descendant",
    "date": "01/09/2025",
    "tbn": "https://i.ibb.co/jkG81t5r/The-First-Descendant-2025-09-01-02-34-59-74.png",
    "src": "https://i.ibb.co/r2MQ19tw/The-First-Descendant-2025-09-01-02-34-59-74.png",
    "width": 3840,
    "height": 2160,
    "dominantColor": "#918264",
    "palette": ["#403020", "#e0e0c0", "#503020", "#604020", "#e0d0b0", "#b09050", "#504020", "#805030"],
    "words": ["tfd"],
    "characters": ["Ultimate Bunny"],
    "extras": []
  },
  {
    "id": "PM-VX2SU9",
    "title": "The First Descendant",
    "date": "30/08/2025",
    "tbn": "https://i.ibb.co/LXLyLhjc/The-First-Descendant-2025-08-30-23-04-16-40.png",
    "src": "https://i.ibb.co/4n6L6gvX/The-First-Descendant-2025-08-30-23-04-16-40.png",
    "width": 2141,
    "height": 2677,
    "dominantColor": "#6b4e56",
    "palette": ["#402020", "#402030", "#503030", "#705060", "#502020", "#503040", "#906070", "#604040"],
    "words": ["tfd"],
    "characters": ["Ines"],
    "extras": []
  },
  {
    "id": "PM-LVH5EA",
    "title": "The First Descendant",
    "date": "20/08/2025",
    "tbn": "https://i.ibb.co/h1ZfMDP5/The-First-Descendant-2025-08-20-02-51-37-29.png",
    "src": "https://i.ibb.co/qFW5nktG/The-First-Descendant-2025-08-20-02-51-37-29.png",
    "width": 3840,
    "height": 2160,
    "dominantColor": "#373737",
    "palette": [],
    "words": ["tfd"],
    "characters": ["Ines"],
    "extras": []
  },
  {
    "id": "PM-2S3SNW",
    "title": "The First Descendant",
    "date": "20/08/2025",
    "tbn": "https://i.ibb.co/Z6SPQP38/The-First-Descendant-2025-08-20-03-05-21-34.png",
    "src": "https://i.ibb.co/1fM5C53q/The-First-Descendant-2025-08-20-03-05-21-34.png",
    "width": 2160,
    "height": 2160,
    "dominantColor": "#705d56",
    "palette": ["#d08050", "#b06050", "#e0a070", "#c07050", "#503030", "#402020", "#403020", "#e09060"],
    "words": ["tfd"],
    "characters": ["Ines"],
    "extras": []
  },
  {
    "id": "PM-DDSE7M",
    "title": "The First Descendant",
    "date": "11/08/2025",
    "tbn": "https://i.ibb.co/7t6RxF9X/The-First-Descendant-2025-08-11-17-44-02-61.png",
    "src": "https://i.ibb.co/yFbYmJ3X/The-First-Descendant-2025-08-11-17-44-02-61.png",
    "width": 3840,
    "height": 1614,
    "dominantColor": "#66605d",
    "palette": ["#c0a090", "#c09090", "#908070", "#8090a0", "#c0a0a0", "#504030", "#a09080", "#807060"],
    "words": ["tfd"],
    "characters": ["Ines"],
    "extras": []
  },
  {
    "id": "PM-T4GFWX",
    "title": "The First Descendant",
    "date": "11/08/2025",
    "tbn": "https://i.ibb.co/7JVtYDLH/The-First-Descendant-2025-08-11-19-32-29-98.png",
    "src": "https://i.ibb.co/BVj2zJFm/The-First-Descendant-2025-08-11-19-32-29-98.png",
    "width": 1936,
    "height": 1936,
    "dominantColor": "#716662",
    "palette": ["#a08080", "#a07070", "#706050", "#b09090", "#e0d0c0", "#605040", "#b08080", "#c09090"],
    "words": ["tfd"],
    "characters": ["Ines"],
    "extras": []
  },
  {
    "id": "PM-8LCHLO",
    "title": "Cyberpunk 2077",
    "date": "02/08/2025",
    "tbn": "https://i.ibb.co/JwtcXJsc/Cyberpunk-2077-2025-08-02-02-40-44-15.png",
    "src": "https://i.ibb.co/21hFX4kF/Cyberpunk-2077-2025-08-02-02-40-44-15.png",
    "width": 3024,
    "height": 2160,
    "dominantColor": "#646f7f",
    "palette": ["#102030", "#005070", "#003050", "#007090", "#004060", "#006080", "#005080", "#002030"],
    "words": ["cp77"],
    "characters": ["V"],
    "extras": []
  },
  {
    "id": "PM-LFH8YU",
    "title": "Cyberpunk 2077",
    "date": "27/07/2025",
    "tbn": "https://i.ibb.co/7d0NXxKL/Cyberpunk-2077-2025-07-27-22-34-15-37.png",
    "src": "https://i.ibb.co/G4r30fRN/Cyberpunk-2077-2025-07-27-22-34-15-37.png",
    "width": 3840,
    "height": 2160,
    "dominantColor": "#5e506d",
    "palette": ["#101030", "#202040", "#102030", "#102040", "#002030", "#201030", "#302040", "#302050"],
    "words": ["cp77"],
    "characters": ["Evelyn Parker"],
    "extras": []
  },
  {
    "id": "PM-MLT4PO",
    "title": "Cyberpunk 2077",
    "date": "21/07/2025",
    "tbn": "https://i.ibb.co/j1BPdwS/Cyberpunk-2077-2025-07-21-10-19-21-66.png",
    "src": "https://i.ibb.co/WYq4QzL/Cyberpunk-2077-2025-07-21-10-19-21-66.png",
    "width": 2160,
    "height": 3840,
    "dominantColor": "#2a1e1b",
    "palette": ["#603020", "#402010", "#301010", "#703020", "#905030", "#502020", "#502010", "#804030"],
    "words": ["cp77"],
    "characters": ["Jackie Welles"],
    "extras": []
  },
  {
    "id": "PM-JHZ0Q0",
    "title": "Elden Ring",
    "date": "18/05/2025",
    "tbn": "https://i.ibb.co/35pg5GS3/Elden-Ring-2025-05-18-22-12-47-84.jpg",
    "src": "https://i.ibb.co/spK8pksf/Elden-Ring-2025-05-18-22-12-47-84.jpg",
    "width": 2160,
    "height": 2789,
    "dominantColor": "#4e5056",
    "palette": ["#203040", "#304050", "#405060", "#301020", "#607080", "#102030", "#506070", "#401020"],
    "words": ["er"],
    "characters": [],
    "extras": [],
    "description": "The tale of House Hoslow is told in blood."
  },
  {
    "id": "PM-AVFQKY",
    "title": "The First Descendant",
    "date": "28/03/2025",
    "tbn": "https://i.ibb.co/j95J0mHP/The-First-Descendant-2025-03-28-23-44-21-00.jpg",
    "src": "https://i.ibb.co/qLnJqKx3/The-First-Descendant-2025-03-28-23-44-21-00.jpg",
    "width": 2595,
    "height": 4613,
    "dominantColor": "#b19e89",
    "palette": ["#d0d0b0", "#d0c0a0", "#d0b090", "#e0d0c0", "#908060", "#d0c090", "#e0c0a0", "#d0b070"],
    "words": ["tfd"],
    "characters": ["Serena"],
    "extras": []
  },
  {
    "id": "PM-7IJM8A",
    "title": "The First Descendant",
    "date": "08/03/2025",
    "tbn": "https://i.ibb.co/B5cwKLpS/The-First-Descendant-2025-03-08-01-12-40-07.png",
    "src": "https://i.ibb.co/xtX38hkR/The-First-Descendant-2025-03-08-01-12-40-07.png",
    "width": 3840,
    "height": 1646,
    "dominantColor": "#aaa893",
    "palette": ["#a0a080", "#b0b090", "#909070", "#808060", "#a09080", "#c0c0a0", "#b0a090", "#807060"],
    "words": ["tfd"],
    "characters": ["Valby"],
    "extras": []
  },
  {
    "id": "PM-NR5DHL",
    "title": "The First Descendant",
    "date": "07/02/2025",
    "tbn": "https://i.ibb.co/23xYvD2M/The-First-Descendant-2025-02-07-17-26-04-27.png",
    "src": "https://i.ibb.co/pjcrftDK/The-First-Descendant-2025-02-07-17-26-04-27.png",
    "width": 2160,
    "height": 2160,
    "dominantColor": "#95918b",
    "palette": ["#706050", "#807060", "#605040", "#102030", "#a0a080", "#a09080", "#d0c0b0", "#908070"],
    "words": ["tfd"],
    "characters": ["Ultimate Bunny"],
    "extras": []
  },
  {
    "id": "PM-026RUS",
    "title": "The First Descendant",
    "date": "07/02/2025",
    "tbn": "https://i.ibb.co/rRpfk1J3/The-First-Descendant-2025-02-07-17-26-07-03.png",
    "src": "https://i.ibb.co/W4zpnY10/The-First-Descendant-2025-02-07-17-26-07-03.png",
    "width": 2160,
    "height": 2160,
    "dominantColor": "#9f9d97",
    "palette": ["#706050", "#807060", "#102030", "#a09080", "#a0a080", "#d0c0b0", "#605040", "#203040"],
    "words": ["tfd"],
    "characters": ["Ultimate Bunny"],
    "extras": []
  },
  {
    "id": "PM-B4KZ8H",
    "title": "The First Descendant",
    "date": "07/02/2025",
    "tbn": "https://i.ibb.co/Tq06b3YL/The-First-Descendant-2025-02-07-15-35-43-45.png",
    "src": "https://i.ibb.co/DgMh82zp/The-First-Descendant-2025-02-07-15-35-43-45.png",
    "width": 2160,
    "height": 3240,
    "dominantColor": "#928071",
    "palette": ["#806050", "#504030", "#605040", "#604030", "#706050", "#807050", "#706040", "#705040"],
    "words": ["tfd"],
    "characters": ["Hailey"],
    "extras": []
  },
  {
    "id": "PM-OYE2OO",
    "title": "Infinity Nikki",
    "date": "30/01/2025",
    "tbn": "https://i.ibb.co/LXpP4wBL/Infinity-Nikki-2025-01-30-17-22-47-00.jpg",
    "src": "https://i.ibb.co/TxhTzXJV/Infinity-Nikki-2025-01-30-17-22-47-00.jpg",
    "width": 7680,
    "height": 3292,
    "dominantColor": "#707881",
    "palette": ["#102030", "#006030", "#203040", "#004010", "#005020", "#303050", "#006040", "#202040"],
    "words": [],
    "characters": [],
    "extras": []
  },
  {
    "id": "PM-SCXC96",
    "title": "Infinity Nikki",
    "date": "29/01/2025",
    "tbn": "https://i.ibb.co/DfwtrX5q/Infinity-Nikki-2025-01-29-15-27-51-00.jpg",
    "src": "https://i.ibb.co/v4LHX5Zt/Infinity-Nikki-2025-01-29-15-27-51-00.jpg",
    "width": 3840,
    "height": 2160,
    "dominantColor": "#846a80",
    "palette": ["#a08090", "#b090a0", "#302080", "#202070", "#403050", "#c0a0a0", "#404020", "#201050"],
    "words": [],
    "characters": [],
    "extras": []
  },
  {
    "id": "PM-ZTX62K",
    "title": "Infinity Nikki",
    "date": "29/01/2025",
    "tbn": "https://i.ibb.co/HpRDYBX2/Infinity-Nikki-2025-01-29-16-38-02-02.jpg",
    "src": "https://i.ibb.co/84GD2NXB/Infinity-Nikki-2025-01-29-16-38-02-02.jpg",
    "width": 2160,
    "height": 3840,
    "dominantColor": "#314367",
    "palette": ["#102040", "#001030", "#60a0e0", "#5080d0", "#6090d0", "#3050a0", "#70a0d0", "#101030"],
    "words": [],
    "characters": [],
    "extras": []
  },
  {
    "id": "PM-IY9TLA",
    "title": "Infinity Nikki",
    "date": "29/01/2025",
    "tbn": "https://i.ibb.co/v6TvW9Bt/Infinity-Nikki-2025-01-29-18-03-32-00.jpg",
    "src": "https://i.ibb.co/dwVJvZch/Infinity-Nikki-2025-01-29-18-03-32-00.jpg",
    "width": 2160,
    "height": 3840,
    "dominantColor": "#172239",
    "palette": ["#001030", "#002050", "#001040", "#002060", "#001050", "#002040", "#103060", "#003080"],
    "words": [],
    "characters": [],
    "extras": []
  },
  {
    "id": "PM-DMRV06",
    "title": "Baldur's Gate 3",
    "date": "13/10/2024",
    "tbn": "https://i.ibb.co/spsxXC01/Baldur-s-Gate-3-2024-10-13-15-29-13-07.jpg",
    "src": "https://i.ibb.co/nqQdKBH1/Baldur-s-Gate-3-2024-10-13-15-29-13-07.jpg",
    "width": 3840,
    "height": 2160,
    "dominantColor": "#68463e",
    "palette": ["#302010", "#c00010", "#301010", "#403020", "#b00010", "#d00010", "#900010", "#e00010"],
    "words": ["bg3"],
    "characters": ["Orin"],
    "extras": [],
    "description": "Deathbringer of Bhaal"
  },
  {
    "id": "PM-EFO2PV",
    "title": "Star Wars Jedi: Survivor",
    "date": "20/09/2024",
    "tbn": "https://i.ibb.co/xKQZ6Hpb/Star-Wars-Jedi-Survivor-2024-09-20-21-48-50-11.jpg",
    "src": "https://i.ibb.co/hxv0VfPN/Star-Wars-Jedi-Survivor-2024-09-20-21-48-50-11.jpg",
    "width": 3840,
    "height": 2160,
    "dominantColor": "#c0cccd",
    "palette": ["#b0c0d0", "#b0d0d0", "#a0c0d0", "#607080", "#a0c0c0", "#a0b0c0", "#90b0c0", "#506070"],
    "words": [],
    "characters": [],
    "extras": []
  },
  {
    "id": "PM-C10DVP",
    "title": "Star Wars Jedi: Survivor",
    "date": "20/09/2024",
    "tbn": "https://i.ibb.co/q3bDjrvs/Star-Wars-Jedi-Survivor-2024-09-20-21-50-52-32.jpg",
    "src": "https://i.ibb.co/zTKmx4zR/Star-Wars-Jedi-Survivor-2024-09-20-21-50-52-32.jpg",
    "width": 1464,
    "height": 2603,
    "dominantColor": "#b3c8cf",
    "palette": ["#b0d0d0", "#c0d0e0", "#a0c0d0", "#90c0d0", "#407090", "#c0e0e0", "#507090", "#306080"],
    "words": [],
    "characters": [],
    "extras": []
  },
  {
    "id": "PM-A8WGVP",
    "title": "Star Wars Jedi: Survivor",
    "date": "16/09/2024",
    "tbn": "https://i.ibb.co/0jgDsmfD/Star-Wars-Jedi-Survivor-2024-09-16-16-22-32-44.jpg",
    "src": "https://i.ibb.co/XZh2Yjz2/Star-Wars-Jedi-Survivor-2024-09-16-16-22-32-44.jpg",
    "width": 3840,
    "height": 2160,
    "dominantColor": "#81684d",
    "palette": ["#705030", "#604030", "#504030", "#403020", "#805030", "#605030", "#503020", "#704030"],
    "words": [],
    "characters": [],
    "extras": []
  },
  {
    "id": "PM-H1GIIY",
    "title": "Baldur's Gate 3",
    "date": "02/09/2024",
    "tbn": "https://i.ibb.co/7JqpzLCC/Baldur-s-Gate-3-2024-09-02-21-31-10-00.jpg",
    "src": "https://i.ibb.co/8DHxBtss/Baldur-s-Gate-3-2024-09-02-21-31-10-00.jpg",
    "width": 2603,
    "height": 2603,
    "dominantColor": "#4c4157",
    "palette": ["#402030", "#503030", "#102030", "#202040", "#402020", "#303050", "#703040", "#301020"],
    "words": ["bg3"],
    "characters": ["Shadowheart", "Tav"],
    "extras": []
  },
  {
    "id": "PM-FWRY6Q",
    "title": "Baldur's Gate 3",
    "date": "28/08/2024",
    "tbn": "https://i.ibb.co/Xrt8JchW/Baldur-s-Gate-3-2024-08-28-16-46-32-00.jpg",
    "src": "https://i.ibb.co/cSQLT4Gy/Baldur-s-Gate-3-2024-08-28-16-46-32-00.jpg",
    "width": 3840,
    "height": 2160,
    "dominantColor": "#3a3a3a",
    "words": ["bg3"],
    "characters": [],
    "extras": []
  },
  {
    "id": "PM-DELZM9",
    "title": "Baldur's Gate 3",
    "date": "25/08/2024",
    "tbn": "https://i.ibb.co/MktW4xXL/Baldur-s-Gate-3-2024-08-25-18-40-55-00.jpg",
    "src": "https://i.ibb.co/RTsZmk5W/Baldur-s-Gate-3-2024-08-25-18-40-55-00.jpg",
    "width": 3840,
    "height": 2160,
    "dominantColor": "#201f2b",
    "palette": ["#101030", "#201030", "#001030", "#202040", "#102030", "#301020", "#402050", "#202050"],
    "words": ["bg3"],
    "characters": ["Spectator"],
    "extras": []
  },
  {
    "id": "PM-UMJUL5",
    "title": "Elden Ring",
    "date": "03/08/2024",
    "tbn": "https://i.ibb.co/HLs2Xd7h/Elden-Ring-2024-08-03-19-44-59-00.jpg",
    "src": "https://i.ibb.co/twth3XBL/Elden-Ring-2024-08-03-19-44-59-00.jpg",
    "width": 3840,
    "height": 2160,
    "dominantColor": "#91472a",
    "palette": ["#502010", "#402010", "#501010", "#401010", "#302010", "#601010", "#301010", "#602010"],
    "words": ["er"],
    "characters": [],
    "extras": []
  },
  {
    "id": "PM-K1XQPR",
    "title": "Elden Ring",
    "date": "01/08/2024",
    "tbn": "https://i.ibb.co/spH8rCdL/Elden-Ring-2024-08-01-17-32-15-00.jpg",
    "src": "https://i.ibb.co/wZs517FD/Elden-Ring-2024-08-01-17-32-15-00.jpg",
    "width": 1924,
    "height": 3840,
    "dominantColor": "#7f96aa",
    "palette": ["#a0b0c0", "#b0c0d0", "#406090", "#90b0c0", "#407090", "#80a0b0", "#7090b0", "#5070a0"],
    "words": ["er"],
    "characters": [],
    "extras": []
  },
  {
    "id": "PM-7VWKHR",
    "title": "Elden Ring",
    "date": "27/07/2024",
    "tbn": "https://i.ibb.co/GmXRvVb/Elden-Ring-2024-07-27-17-25-24-00.jpg",
    "src": "https://i.ibb.co/6Q2FR4f/Elden-Ring-2024-07-27-17-25-24-00.jpg",
    "width": 3840,
    "height": 2160,
    "dominantColor": "#808277",
    "palette": ["#102030", "#406060", "#203040", "#204040", "#a09060", "#305050", "#b0a070", "#a0a080"],
    "words": ["er"],
    "characters": [],
    "extras": []
  },
  {
    "id": "PM-R9SX7G",
    "title": "Elden Ring",
    "date": "26/07/2024",
    "tbn": "https://i.ibb.co/hJbf6tsM/Elden-Ring-2024-07-26-15-27-45-00.jpg",
    "src": "https://i.ibb.co/zTpJM0s5/Elden-Ring-2024-07-26-15-27-45-00.jpg",
    "width": 2603,
    "height": 2603,
    "dominantColor": "#776b67",
    "palette": ["#102030", "#102040", "#306090", "#202040", "#203040", "#3060a0", "#206090", "#d0b070"],
    "words": ["er"],
    "characters": [],
    "extras": []
  },
  {
    "id": "PM-GZ54XZ",
    "title": "Elden Ring",
    "date": "26/07/2024",
    "tbn": "https://i.ibb.co/nq0GG4m9/Elden-Ring-2024-07-26-16-32-24-00.jpg",
    "src": "https://i.ibb.co/FkWrrc32/Elden-Ring-2024-07-26-16-32-24-00.jpg",
    "width": 1458,
    "height": 2592,
    "dominantColor": "#37627a",
    "palette": ["#102030", "#103040", "#103050", "#102040", "#203040", "#203050", "#204060", "#60b0c0"],
    "words": ["er"],
    "characters": ["Ranni"],
    "extras": [],
    "description": "Oh? A dogged fellow, aren't we? Or is it merely thy habit, to talk to dolls? Fine...fine."
  },
  {
    "id": "PM-A87NG9",
    "title": "Elden Ring",
    "date": "26/07/2024",
    "tbn": "https://i.ibb.co/rGPqw1tb/Elden-Ring-2024-07-26-16-35-29-00.jpg",
    "src": "https://i.ibb.co/hR5rmtMX/Elden-Ring-2024-07-26-16-35-29-00.jpg",
    "width": 3840,
    "height": 2160,
    "dominantColor": "#695138",
    "palette": ["#504030", "#403020", "#705030", "#906030", "#605030", "#b08040", "#604030", "#503020"],
    "words": ["er"],
    "characters": [],
    "extras": []
  }
]
};
